{
  "artifacts": {
    "canonical_rollout_index": "canonical_rollout_index.parquet",
    "checkpoint_inventory": "checkpoint_inventory.csv",
    "diagnostic_results": "diagnostic_results.txt",
    "discovery_report": "discovery_report.md",
    "domain_triangle_gate": "domain_triangle_gate.json",
    "edge_gate": "edge_gate.json",
    "family_decision_matrix": "family_decision_matrix.json",
    "manifest": "manifest.json",
    "policy_class_gate": "policy_class_gate.json",
    "reward_validity_gate": "reward_validity_gate.json",
    "source_and_logs": "source_and_logs.tar.gz",
    "status": "status.json"
  },
  "decision": {
    "matched_rule_id": null,
    "reason": "no preregistered row matched; unresolved variables: ['R', 'T', 'E', 'L', 'F']",
    "selected_family": null,
    "status": "NO_ELIGIBLE_FAMILY"
  },
  "decision_variables": {
    "E": {
      "evidence_diagnostics": [
        "58"
      ],
      "reason": "diag_58 status is SKIPPED_DEPENDENCY",
      "value": "UNKNOWN"
    },
    "F": {
      "evidence_diagnostics": [
        "61"
      ],
      "reason": "diag_61 status is SKIPPED_DEPENDENCY",
      "value": "UNKNOWN"
    },
    "L": {
      "evidence_diagnostics": [
        "60"
      ],
      "reason": "diag_60 status is SKIPPED_DEPENDENCY",
      "value": "UNKNOWN"
    },
    "R": {
      "evidence_diagnostics": [
        "27"
      ],
      "reason": "diag_27 status is SKIPPED_DEPENDENCY",
      "value": "UNKNOWN"
    },
    "T": {
      "evidence_diagnostics": [
        "47"
      ],
      "reason": "diag_47 status is SKIPPED_DEPENDENCY",
      "value": "UNKNOWN"
    },
    "X": {
      "evidence_diagnostics": [
        "62"
      ],
      "reason": "real PhysX candidate grid has no preregistered non-trivial success/failure boundary",
      "value": "-"
    }
  },
  "diagnostics": [
    {
      "blocking": true,
      "command": [
        "/home/y/miniconda3/envs/env_isaaclab/bin/python",
        "/home/y/my_mimic_mixgrpo/fcamp/tools/diag_00_freeze_manifest.py",
        "--spec",
        "/home/y/my_mimic_mixgrpo/fcamp/diagnostics/specs/largebox_discovery_v1.yaml",
        "--output-dir",
        "/home/y/my_mimic_mixgrpo/fcamp/output/largebox_discovery_v1"
      ],
      "dependencies": [],
      "diagnostic_id": "00",
      "duration_seconds": null,
      "exit_code": null,
      "expected_outputs": [
        "manifest.json"
      ],
      "finished_at": null,
      "metadata": {
        "resumed": true
      },
      "name": "freeze_manifest",
      "observed_outputs": [
        "manifest.json"
      ],
      "reason": "reused existing valid status artifact",
      "required": true,
      "stage": "0_identity_lineage",
      "started_at": null,
      "status": "PASS",
      "status_artifact": "manifest.json",
      "stderr_log": null,
      "stdout_log": null
    },
    {
      "blocking": true,
      "command": [
        "/home/y/miniconda3/envs/env_isaaclab/bin/python",
        "/home/y/my_mimic_mixgrpo/fcamp/tools/diag_01_task_identity.py",
        "--spec",
        "/home/y/my_mimic_mixgrpo/fcamp/diagnostics/specs/largebox_discovery_v1.yaml",
        "--output-dir",
        "/home/y/my_mimic_mixgrpo/fcamp/output/largebox_discovery_v1"
      ],
      "dependencies": [
        "00"
      ],
      "diagnostic_id": "01",
      "duration_seconds": null,
      "exit_code": null,
      "expected_outputs": [
        "task_identity.json"
      ],
      "finished_at": null,
      "metadata": {
        "resumed": true
      },
      "name": "task_identity",
      "observed_outputs": [
        "task_identity.json"
      ],
      "reason": "reused existing valid status artifact",
      "required": true,
      "stage": "0_identity_lineage",
      "started_at": null,
      "status": "PASS",
      "status_artifact": "task_identity.json",
      "stderr_log": null,
      "stdout_log": null
    },
    {
      "blocking": true,
      "command": [
        "/home/y/miniconda3/envs/env_isaaclab/bin/python",
        "/home/y/my_mimic_mixgrpo/fcamp/tools/diag_02_checkpoint_inventory.py",
        "--spec",
        "/home/y/my_mimic_mixgrpo/fcamp/diagnostics/specs/largebox_discovery_v1.yaml",
        "--output-dir",
        "/home/y/my_mimic_mixgrpo/fcamp/output/largebox_discovery_v1"
      ],
      "dependencies": [
        "00",
        "01"
      ],
      "diagnostic_id": "02",
      "duration_seconds": null,
      "exit_code": null,
      "expected_outputs": [
        "checkpoint_inventory.csv",
        "checkpoint_inventory.status.json"
      ],
      "finished_at": null,
      "metadata": {
        "resumed": true
      },
      "name": "checkpoint_inventory",
      "observed_outputs": [
        "checkpoint_inventory.csv",
        "checkpoint_inventory.status.json"
      ],
      "reason": "reused existing valid status artifact",
      "required": true,
      "stage": "0_identity_lineage",
      "started_at": null,
      "status": "PASS",
      "status_artifact": "checkpoint_inventory.status.json",
      "stderr_log": null,
      "stdout_log": null
    },
    {
      "blocking": true,
      "command": [
        "/home/y/miniconda3/envs/env_isaaclab/bin/python",
        "/home/y/my_mimic_mixgrpo/fcamp/tools/diag_03_resume_reproducibility.py",
        "--spec",
        "/home/y/my_mimic_mixgrpo/fcamp/diagnostics/specs/largebox_discovery_v1.yaml",
        "--output-dir",
        "/home/y/my_mimic_mixgrpo/fcamp/output/largebox_discovery_v1"
      ],
      "dependencies": [
        "02"
      ],
      "diagnostic_id": "03",
      "duration_seconds": null,
      "exit_code": null,
      "expected_outputs": [
        "resume_diff.json"
      ],
      "finished_at": null,
      "metadata": {
        "resumed": true
      },
      "name": "resume_reproducibility",
      "observed_outputs": [
        "resume_diff.json"
      ],
      "reason": "reused existing valid status artifact",
      "required": true,
      "stage": "0_identity_lineage",
      "started_at": null,
      "status": "PASS",
      "status_artifact": "resume_diff.json",
      "stderr_log": null,
      "stdout_log": null
    },
    {
      "blocking": false,
      "command": [
        "/home/y/miniconda3/envs/env_isaaclab/bin/python",
        "/home/y/my_mimic_mixgrpo/fcamp/tools/diag_05_teacher_learning_curve.py",
        "--spec",
        "/home/y/my_mimic_mixgrpo/fcamp/diagnostics/specs/largebox_discovery_v1.yaml",
        "--output-dir",
        "/home/y/my_mimic_mixgrpo/fcamp/output/largebox_discovery_v1"
      ],
      "dependencies": [
        "02"
      ],
      "diagnostic_id": "05",
      "duration_seconds": null,
      "exit_code": null,
      "expected_outputs": [
        "teacher_transition.json",
        "tables/teacher_learning_curve.csv"
      ],
      "finished_at": null,
      "metadata": {
        "resumed": true
      },
      "name": "teacher_learning_curve",
      "observed_outputs": [
        "teacher_transition.json",
        "tables/teacher_learning_curve.csv"
      ],
      "reason": "reused existing valid status artifact",
      "required": true,
      "stage": "0_identity_lineage",
      "started_at": null,
      "status": "PASS",
      "status_artifact": "teacher_transition.json",
      "stderr_log": null,
      "stdout_log": null
    },
    {
      "blocking": true,
      "command": [
        "/home/y/miniconda3/envs/env_isaaclab/bin/python",
        "/home/y/my_mimic_mixgrpo/fcamp/tools/diag_10_dense_teacher_checkpoints.py",
        "--spec",
        "/home/y/my_mimic_mixgrpo/fcamp/diagnostics/specs/largebox_discovery_v1.yaml",
        "--output-dir",
        "/home/y/my_mimic_mixgrpo/fcamp/output/largebox_discovery_v1"
      ],
      "dependencies": [
        "03",
        "05"
      ],
      "diagnostic_id": "10",
      "duration_seconds": null,
      "exit_code": null,
      "expected_outputs": [
        "checkpoints/dense_checkpoint_inventory.csv"
      ],
      "finished_at": null,
      "metadata": {
        "resumed": true
      },
      "name": "dense_teacher_checkpoints",
      "observed_outputs": [
        "checkpoints/dense_checkpoint_inventory.csv"
      ],
      "reason": "reused existing valid status artifact",
      "required": true,
      "stage": "1_canonical_banks",
      "started_at": null,
      "status": "PASS",
      "status_artifact": "checkpoints/dense_checkpoint_inventory.status.json",
      "stderr_log": null,
      "stdout_log": null
    },
    {
      "blocking": true,
      "command": [
        "/home/y/miniconda3/envs/env_isaaclab/bin/python",
        "/home/y/my_mimic_mixgrpo/fcamp/tools/diag_11_build_snapshot_bank.py",
        "--spec",
        "/home/y/my_mimic_mixgrpo/fcamp/diagnostics/specs/largebox_discovery_v1.yaml",
        "--output-dir",
        "/home/y/my_mimic_mixgrpo/fcamp/output/largebox_discovery_v1"
      ],
      "dependencies": [
        "00",
        "01"
      ],
      "diagnostic_id": "11",
      "duration_seconds": null,
      "exit_code": null,
      "expected_outputs": [
        "snapshot_bank.pt"
      ],
      "finished_at": null,
      "metadata": {
        "resumed": true
      },
      "name": "build_snapshot_bank",
      "observed_outputs": [
        "snapshot_bank.pt"
      ],
      "reason": "reused existing valid status artifact",
      "required": true,
      "stage": "1_canonical_banks",
      "started_at": null,
      "status": "PASS",
      "status_artifact": "snapshot_bank.status.json",
      "stderr_log": null,
      "stdout_log": null
    },
    {
      "blocking": true,
      "command": [
        "/home/y/miniconda3/envs/env_isaaclab/bin/python",
        "/home/y/my_mimic_mixgrpo/fcamp/tools/diag_12_collect_canonical_rollouts.py",
        "--spec",
        "/home/y/my_mimic_mixgrpo/fcamp/diagnostics/specs/largebox_discovery_v1.yaml",
        "--output-dir",
        "/home/y/my_mimic_mixgrpo/fcamp/output/largebox_discovery_v1"
      ],
      "dependencies": [
        "10",
        "11"
      ],
      "diagnostic_id": "12",